{
  "schema_version": 2,
  "entry_kind": "adversarial",
  "expected_verdict": "REJECTED_P_HACKING",
  "flaws": [
    {
      "type": "p_hacking",
      "severity": "fatal",
      "location": "code_implementation:main (best-of-sweep selection and naive_p inference)",
      "description": "The best configuration (SMA 15/120, Sharpe 0.86, 'p=0.008') was selected from 48 trials on a driftless random walk and its p-value computed as if it were the only test ever run; the expected MAX Sharpe over 48 null trials is ~0.57, so the winner is an order statistic of noise.",
      "detection": "Apply a multiple-testing correction to the best observed statistic: compare it against the permutation null distribution of the grid-wide MAX Sharpe (simplified White reality check). Here the corrected p-value is ~0.19 vs a naive 0.008 — significance evaporates under the correct null.",
      "corrective_action": "Report max-statistic-corrected p-values (or at minimum Bonferroni, here ~0.36) for any swept statistic, or confirm the selected configuration on a sealed holdout that played no role in selection before reporting it."
    },
    {
      "type": "multiple_testing_abuse",
      "severity": "high",
      "location": "research_corpus:data_engineering (grid design)",
      "description": "The 6x8 grid contains heavily overlapping configurations (correlated strategies), which makes the naive 'winner looks stable across neighbors' defense misleading: neighboring cells share most of their trades, so an apparent plateau of good Sharpes is one lucky draw seen 48 times, not 48 confirmations.",
      "detection": "Compute the correlation matrix of the 48 strategy return streams; mean pairwise correlations far above zero mean the effective number of independent trials is far below 48, and 'neighborhood stability' arguments must be discarded in favor of the max-statistic null, which handles the correlation automatically.",
      "corrective_action": "Always use a correction that preserves the dependence structure (permutation/bootstrap of the full grid) rather than treating grid cells as independent evidence; never argue significance from parameter-plateau smoothness alone."
    }
  ],
  "static_checks": {
    "require_vectorized": true,
    "forbid_pandas_row_loops": true,
    "allowed_sequential_loops": [
      {
        "function": "strategy_sharpes",
        "reason": "loop over 48 strategy configurations (not over time/rows); each config's backtest is fully vectorized",
        "max_iterations": 48
      },
      {
        "function": "max_stat_permutation",
        "reason": "each permutation draw must be generated and evaluated independently to build the null",
        "max_iterations": 200
      }
    ]
  },
  "rlm": {
    "environment_class": null,
    "actions": [],
    "max_recursion_depth": 1,
    "tool_timeout_seconds": 120
  },
  "training_sequence": {
    "style": "multi_turn_audit",
    "include_adversarial_critique": true,
    "include_final_calibrated_answer": true,
    "loss_masking": {
      "user": 0.0,
      "environment_observation": 0.0,
      "assistant_thought": 1.0,
      "tool_call": 1.0,
      "final_answer": 1.0
    }
  },
  "metadata": {
    "id": "qlm1-000005-adversarial-p-hacking-sweep",
    "domain": "Parameter Selection / Multiple Testing",
    "complexity": 7,
    "tags": [
      "adversarial",
      "p-hacking",
      "multiple-testing",
      "reality-check",
      "max-statistic",
      "block-permutation",
      "parameter-sweep",
      "order-statistics"
    ]
  },
  "agent_thought_process": {
    "initial_analysis": "A researcher swept 48 SMA configurations, found one with Sharpe 0.86 and p=0.008, and wants to trade it. The audit question is not 'is 0.86 good?' but 'good compared to WHAT null?'. Selecting the maximum of 48 correlated trials changes the null distribution from 'one strategy's Sharpe' to 'the maximum of 48 strategies' Sharpes' — and on pure noise that maximum averages ~0.57. The audit must rebuild the correct null with the selection step INSIDE it.",
    "tool_selection": "Python REPL with numpy for the vectorized grid backtests and the block-permutation engine, scipy.stats for the naive normal p-value (kept only as the exhibit of the flaw). No statsmodels needed — the permutation test builds its own null.",
    "recursive_delegation": "The 200 permutation draws are embarrassingly parallel: delegate shards of draws to sub-agents, each returning its vector of null max-Sharpes. The parent MUST own the selection step and the final quantile computation — delegating 'find the best config' to one agent and 'test it' to another without sharing the trial count is exactly how p-hacking happens organizationally."
  },
  "research_corpus": {
    "hypothesis_formulation": "Naive claim: the best swept configuration (SMA 15/120) has true Sharpe > 0 (naive one-sided p=0.008 from SR*sqrt(T_years) ~ N(0,1)). Audit hypotheses — H0: all 48 configurations have zero true edge and the observed best is the expected order statistic of noise; H1: the best configuration's edge exceeds what maximal selection from 48 correlated null trials produces. Test: p_corrected = (1 + #{max-null draws >= observed best}) / (B+1) under a moving-block permutation null (B=200, block 21), plus Bonferroni as a cheap upper-bound cross-check. Ground truth is H0 by construction (driftless walk).",
    "data_engineering": "2016 days (8 years) of seeded DRIFTLESS log returns at 18% vol — the generator guarantees every strategy's true edge is exactly zero, so any 'discovery' is definitionally spurious and the audit's job is to say so. Grid: 6 fast x 8 slow = 48 configurations. Every individual backtest is honest (one-bar lag, 2 bps turnover costs, warm-up flat): the flaw is planted exclusively in the inference-after-selection step, which is what makes this entry seductive — reading any single backtest reveals nothing wrong.",
    "methodology_justification": "The max-statistic permutation test (simplified White 2000 reality check) is the appropriate correction because it (a) uses the null distribution of the SELECTED statistic — the grid maximum — rather than a single strategy's, and (b) preserves the correlation structure across the 48 strategies automatically, since each permutation re-runs the entire grid on the same resampled path. Bonferroni is reported alongside as the assumption-free upper bound: it over-corrects under correlation, so agreement between both (neither significant) is decisive. Block permutation (block 21) rather than IID shuffling preserves short-range dependence so the null is not artificially easy to beat.",